,annex_2_8_9_code,annex_1_code,national_code,type_of_waste,annex_3_code,amount,countries_of_transit ,country_of_destination,annex_4_a_code,annex_4_b_code,country,year
0,A4160,,,Spent activated Carbon,H11,120.0,,BE,,R7,Tunisia,2017
1,A1130,Y17,,Spent alkaline solution containing copper,H8,917.97,,IT,,R5,Tunisia,2017
2,"A1020,A3180",Y10,"200201, 150301 , 150101","Electric transformer, condenser, transformer oil containing /contaminated with PCB","H11,H12",188.56,"DE,IT,MT,NL,ES,GB",BE,,"R4,R12",Tunisia,2017
3,A4140,Y13,,Solid contaminated by paint and solvents,H4.1,14.64,,FR,"D10,D13",,Tunisia,2017
4,A4140,Y13,,Solid contaminated by solvents,H4.1,16.04,,FR,"D10,D13",,Tunisia,2017
5,A4070,Y12,,Solid and mixture containing inflammable  liquid,H4.1,50.0,,FR,,"R1,R12",Tunisia,2017
6,A4140,,,Chemicals of laboratories containing hazardous substances ,"H4.3,H6.1",240.0,,FR,,"R1,R12",Tunisia,2017
